CountryName,CountryCode,StartDate,EndDate,PolicyType,PolicyValue,Flag,InitialNote
Dominica,DMA,20201207,20201221,C6: Stay at home requirements,2,1,"At the press conference held in the Green Room of the National Palace, together with the legal consultant of the Executive Power, Antoliano Peralta Romero, the presidential spokesperson referred to the mode of curfew hours and the limits of meetings in public and private spaces for public use.    ""After the concerns expressed by some sectors of society, we have deemed it pertinent to make the following clarifications regarding the new social distancing measures adopted by the Government this December 15 through Decree 698-20,"" said Germán.      Here are the details:    ""Now we have two different hours for the curfew, depending on the locality. On the one hand, in the National District and the provinces of Santo Domingo, Santiago, Duarte, La Vega and Puerto Plata this applies every day from 7:00 pm to 5:00 am ”, explained Germán.      While, in the rest of the country, the curfew applies from Monday to Friday from 9:00 p.m. to 5:00 a.m. and Saturdays, Sundays and holidays from 7:00 p.m. to 5:00 a.m.     The spokesperson for the Presidency clarified the limitations of the new measures in relation to transfer to homes. “At these times that we have indicated, all curfew restrictions begin to apply, including the closure of public spaces, with the only exception that those days and places in which the curfew begins at 7: 00 pm, a two-hour grace period has been granted, that is, until 9:00 pm with the exclusive purpose that people can move quietly home, without the anguish that they will be detained for reasons beyond their control, such as the traffic jams that usually take place in hours close to curfew ”.    He added: “Regarding the gathering of people, it has been prohibited for more than 10 people to gather in public and private spaces for public use. This means that in these spaces more than 10 people can coincide at the same time, but they cannot gather in groups larger than that amount, as would happen in a shopping plaza, a transport station or a park ”.    The same restriction applies to establishments such as restaurants and bars, where tables cannot be occupied by more than 10 people and always respecting the sanitary protocols of the sector, such as not exceeding 70% of the total capacity of the premises.      “Finally, we wish to highlight that all the traffic exceptions during the curfew hours that we had previously, such as those relating to doctors and nurses and other health personnel, the one relating to international passengers heading or they return from the airport or the operators of vehicles dedicated to the distribution of food, supplies, fuels and other essential products, among other cases that can be detailed in article 4 of Decree 698-20, ""he said.    https://web.archive.org/web/20201221140355/https://presidencia.gob.do/noticias/la-portavoz-de-la-presidencia-detalla-el-alcance-de-las-medidas-del-toque-de-queda  "
Dominica,DMA,20201207,20201221,E2: Debt/contract relief,1,,"There was a price of petroleum products released in September. This notice is valid till December 31st, 2020. Please see: https://web.archive.org/web/20201221224021/https://dominica.gov.dm/notices/1121-price-regualtion-petroleum-products-effective-september-21-2020"
Dominica,DMA,20201207,20201221,H2: Testing policy,2,,"According to the US Embassy in Dominica's website, The Dominican Republic has local capacity to diagnose COVID-19 through the National Public Health Laboratory and private laboratories.  The Dominican Republic created a national hotline for questions relating to COVID-19 if you have been exposed or are experiencing severe symptoms.  Call *462 for further instructions, but note that English-speaking operators are limited.    Please see:   https://web.archive.org/web/20201221134212/https://do.usembassy.gov/u-s-citizen-services/covid-19-information/    The rapid tests are free and the PCR test costs $40. Please see:  https://web.archive.org/web/20201221230041/https://discoverdominica.com/en/travel-advisory-for-dominica"
Dominica,DMA,20201222,20210106,C1: School closing,0,,"Academic break.   https://archive.vn/QR2yu"
Dominica,DMA,20201222,,C2: Workplace closing,0,,"Businesses, shops, offices, churches, sports facilities and beauty salons are now operating normally without restriction, except for health protocols (physical distancing, hand sanitising, wearing face masks). Hotels and tour operators are not open in full capacity.   https://web.archive.org/web/20201205233138/https://www.gov.uk/foreign-travel-advice/dominica/coronavirus"
Dominica,DMA,20201222,20210212,C3: Cancel public events,0,,"No restrictions found. "
Dominica,DMA,20201222,20210212,C4: Restrictions on gatherings,2,1,"""A maximum of 250 persons may gather together at any one time.""   https://web.archive.org/web/20201205233138/https://www.gov.uk/foreign-travel-advice/dominica/coronavirus"
Dominica,DMA,20201222,,C6: Stay at home requirements,1,1,"People are recommended by the Ministry of Health, Wellness and New Health Investment Response to COVID-19 to ""keep the elderly home to reduce their risk of getting sick"" and ""limit visitors"".  https://web.archive.org/web/20210118164837/http://dominica.gov.dm/tips-to-protect-self-family"
Dominica,DMA,20201222,,E2: Debt/contract relief,0,,"No policy found. "
Dominica,DMA,20201222,,H2: Testing policy,3,,"Community level testing still continuing.   http://web.archive.org/web/20210208114529/https://www.dominicavibes.dm/news-264073/"
Dominica,DMA,20201222,,H6: Facial Coverings,2,1,"Required in public transportation.    https://web.archive.org/web/20201205233138/https://www.gov.uk/foreign-travel-advice/dominica/coronavirus  If you are healthy, you only need to wear a mask if you are taking care of a person with suspected 2019-nCoV infection.  https://web.archive.org/web/20210118180555/http://dominica.gov.dm/wear-a-mask-to-protect-against-coronavirus"
Dominica,DMA,20210107,20210524,C1: School closing,1,1,"Fully open under government safety guidance.   https://archive.vn/QR2yu"
Dominica,DMA,20210213,20210216,C3: Cancel public events,2,1,"No carnival celebration is allowed.   Acting Chief of Police, Lincoln Corbette says as a result of the cancellation of Carnival 2021, there will be no street jump up throughout the island: ""Permissions have not been granted to anyone to host any event over the carnival weekend"".   http://web.archive.org/web/20210222202458/https://www.dominicavibes.dm/featured-268514/"
Dominica,DMA,20210213,20210216,C4: Restrictions on gatherings,4,1,"The Minister of National Security announced that ""no gatherings of more than 10 or more persons in a public place including gathering at a camp for religious institutions or other purposes"".   This does not include a gathering of persons who are members of the same household; a gathering at a religious institution; a gathering at the supermarket, shops, or other retail establishments for the purpose of purchasing groceries; a gathering at the restaurant for the purpose of dining on the premises; and a gathering authorized by the Chief of Police.  http://web.archive.org/web/20210222202458/https://www.dominicavibes.dm/featured-268514/"
Dominica,DMA,20210216,20210308,H7: Vaccination policy,4,1,"Vaccine: Oxford-Astrazeneca vaccine from India government  The vaccines will primarily be given to persons in identified groups, namely health care workers, frontline workers such as immigration officers, custom officers, Dominica Air and Sea Port Authority  employees, airport taxi operators, fire officers, police officers, persons with comorbid conditions such as diabetes, hypertension, heart disease, cancer and persons 65 years and older.  Regardless, all Dominican citizens and residents are encouraged to have the vaccine.   http://web.archive.org/web/20210222205404/http://news.gov.dm/news/5182-covid-19-vaccine-rollout-begins"
Dominica,DMA,20210217,20210524,C3: Cancel public events,0,,"No change.   http://web.archive.org/web/20210208111220/https://dominica.gov.dm/images/documents/Safe_Event_Checklist_Rev_2_Nov_1220_v4.pdf"
Dominica,DMA,20210217,,C4: Restrictions on gatherings,2,1,"Policies before the carnival weekend are still in place.   http://web.archive.org/web/20210208110444/https://www.gov.uk/foreign-travel-advice/dominica/coronavirus"
Dominica,DMA,20210223,20210301,H3: Contact tracing,1,,"Latest contact tracing information was published on Jan. 23rd.   https://web.archive.org/web/20210118172639/http://dominica.gov.dm/corona"
Dominica,DMA,20210302,,H3: Contact tracing,2,,"Latest information published on Mar. 1st.   https://archive.fo/WwKPc"
Dominica,DMA,20210309,,H7: Vaccination policy,5,1,"All citizens are encouraged to get vaccinated.   Vaccines: Oxford-AstraZeneca vaccines, Sinopharm  http://web.archive.org/web/20210329194352/https://www.gov.uk/foreign-travel-advice/dominica/coronavirus  https://archive.vn/KKsmB  "
Dominica,DMA,20210514,,E1: Income support,0,,"The Income and Livelihood Support Programs targeting individuals who lost their jobs or business operations due to the Covid-19 Pandemic or the Emergency Powers (Curfew) Order, Statutory Rules and Order No. 15 of 2020, has been extended to facilitate the payment of Grants to eligible person for periods up to April 30, 2021. Deadline for submitting application is 14 May 2021.  https://web.archive.org/web/20210531101529/https://dominica.gov.dm/notices/1242-income-and-livelihood-support-program-extension"
Dominica,DMA,20210525,,C1: School closing,0,,"Schools remain fully open.  https://web.archive.org/web/20210527152420/https://en.unesco.org/covid19/educationresponse"
Dominica,DMA,20210525,,C3: Cancel public events,1,1,"No change in policy.  Any venue of assembly, event, or activity with a designated start/end time or times (or having limited  duration) must not exceed 199 people inclusive of event planning staff and must allow at least 36 sq ft per person.  https://web.archive.org/web/20210527164234/https://dominica.gov.dm/images/documents/Mass_Gathering_Events_Application_Form_Final_Rev_2_Nov_1220v2.pdf"
Dominica,DMA,20210525,,H8: Protection of elderly people,2,1,"No change in policy. Single visitors are allowed to hospital patients and nursing home residents.  https://web.archive.org/web/20210527163628/https://www.gov.uk/foreign-travel-advice/dominica/coronavirus"
Mauritius,MUS,20200301,20200430,E1: Income support,1,1,"The Government of the Republic of Mauritius is providing income support for the months of March and April 2020 (extension provided for April) to both formal and informal sector workers through two schemes: a. the Government Wage Assistance Scheme (GWAS) for employees who would become unemployed on a temporary basis and b. the Self-Employed Assistance Scheme (SEAS) for those employed in informal sectors or self-employed.  All companies in Mauritius can apply for Wage Assistance subsidy to alleviate the employee cost for the month of March ranging from  15 days basic wage bill to MUR 12,500 per employee. Workers from the informal sector, i.e self-employed not registered with the revenue authority will get 50% of the prevailing minimum wage if they register with the revenue authority during the COVID19 lockdown. Since this is calculated based on basic wage in case of formal sector and the minimum wage in case of the informal sector, on average, it might be less than 50% of the monthly income of the employees/workers. https://web.archive.org/web/20200626194901/https://www.imf.org/en/Topics/imf-and-covid19/Policy-Responses-to-COVID-19 https://web.archive.org/web/20200627102230/https://www.edbmauritius.org/media/3163/communique_extension_of_gwas_and_seas.pdf KPMG Mauritius government response: http://archive.vn/YjFAf"
Mauritius,MUS,20200318,20200318,C8: International travel controls,2,,"http://archive.is/2U5mM  As of 18 March, Official Mauritius Tourism website  The Mauritian Authorities have, consequently, taken the following decisions :  * As from 06H00 GMT (10h00 local time) this Thursday, 19 March 2020, borders will be closed for the next 15 days for all passengers (local and international) arriving on the territory.  * All passengers, Mauritian and International, arriving before this deadline, i.e. 06H00 GMT (10h00 local time), will be placed automatically in quarantine."
Mauritius,MUS,20200318,20200531,H2: Testing policy,1,," First cases confirmed, testing begins. https://web.archive.org/web/20200408220226/https://www.straitstimes.com/world/africa/mauritius-reports-first-three-cases-of-coronavirus"
Mauritius,MUS,20200319,20200630,C1: School closing,3,1,"all schools and universities closed starting on March 19: https://web.archive.org/web/20200320002219/https://www.lexpress.mu/article/372754/covid-19-ecoles-fermees-jusqua-nouvel-ordre"
Mauritius,MUS,20200319,20200707,C8: International travel controls,4,,"http://archive.is/2U5mM  Official Mauritius Tourism website  The Mauritian Authorities have, consequently, taken the following decisions :  * As from 06H00 GMT (10h00 local time) this Thursday, 19 March 2020, borders will be closed for the next 15 days for all passengers (local and international) arriving on the territory.  * All passengers, Mauritian and International, arriving before this deadline, i.e. 06H00 GMT (10h00 local time), will be placed automatically in quarantine.    Initially a ban, but after Mauritians were stranded abroad the ban was lifted for a select few Mauritians, who have to stay in quarantine: https://web.archive.org/web/20200406185858/https://defimedia.info/laeroport-de-plaisance-quelque-300-mauriciens-venant-de-londres-et-mumbai-ont-ete-rapatries-indique-girish-appaya; https://web.archive.org/web/20200406190132/https://defimedia.info/coronavirus-aucun-passager-ne-sera-autorise-sur-le-territoire-mauricien-partir-de-ce-jeudi"
Mauritius,MUS,20200320,20200514,C2: Workplace closing,3,1,"National lockdown announced on 19th March, to commence on 20th March.    https://web.archive.org/web/20200406181307/https://defimedia.info/breaking-news-covid-19-pravind-jugnauth-annonce-un-confinement-national"
Mauritius,MUS,20200320,20200611,C3: Cancel public events,2,1,"National lockdown announced on 19th March, to commence on 20th March.      https://web.archive.org/web/20200406181307/https://defimedia.info/breaking-news-covid-19-pravind-jugnauth-annonce-un-confinement-national"
Mauritius,MUS,20200320,20200614,C5: Close public transport,1,1,"National lockdown announced on 19th March, to commence on 20th March. Public transportation will be operated at a minimum level (""opéreront durant cette période au cours de laquelle un service minimum du transport public va opérer"").    https://web.archive.org/web/20200406181307/https://defimedia.info/breaking-news-covid-19-pravind-jugnauth-annonce-un-confinement-national"
Mauritius,MUS,20200321,20200506,H3: Contact tracing,1,,"First mention of tracing made on the 21st with the news of the first death  https://archive.vn/PoLGB News articles mention the need to do more:  https://web.archive.org/web/20200530153349/http://www.mauritiustimes.com/mt/covid-19-and-mauritius-alarm-bell/ "
Mauritius,MUS,20200323,20200611,C4: Restrictions on gatherings,3,1,"The Prime Minister announced a nationwide curfew in effect from 8pm on 23 March. It does not explicitly limit gathering size, however police have been given powers to apprehend anyone found outdoors without a license.    http://web.archive.org/web/20200427192123/http://www.govmu.org/English/News/Pages/Covid-19-Curfew-Order,-to-protect-Mauritians-in-force-as-from-20-00-hrs-today.aspx"
Mauritius,MUS,20200323,20200529,C6: Stay at home requirements,2,1,"The Prime Minister announced a nationwide curfew in effect from 8pm on 23 March. Police have been given powers to apprehend anyone found outdoors without a license or a small set of valid reasons (eg medical treatment or essential supplies).    http://web.archive.org/web/20200427192123/http://www.govmu.org/English/News/Pages/Covid-19-Curfew-Order,-to-protect-Mauritians-in-force-as-from-20-00-hrs-today.aspx"
Mauritius,MUS,20200323,20200529,C7: Restrictions on internal movement,1,1,"The Prime Minister announced a nationwide curfew in effect from 8pm on 23 March. There are not explicit restrictions between regions, but police have been given powers to apprehend anyone found outdoors without a license or a small set of valid reasons (eg medical treatment or essential supplies).    http://web.archive.org/web/20200427192123/http://www.govmu.org/English/News/Pages/Covid-19-Curfew-Order,-to-protect-Mauritians-in-force-as-from-20-00-hrs-today.aspx"
Mauritius,MUS,20200326,,H1: Public information campaigns,2,1,"Mobile app launched on 26th March: https://web.archive.org/save/https://defimedia.info/besafemoris-une-application-gratuite-pour-des-informations-officielles-sur-le-covid-19"
Mauritius,MUS,20200401,20201029,E2: Debt/contract relief,1,,"Support to Households -  Mauritian households impacted by COVID-19 may request their commercial banks for a moratorium of 6 months on capital repayments on their existing household loans as from the 1st April 2020. In addition, for households earning a combined monthly basic salary of up to Rs 50,000 the Bank of Mauritius will bear the interest payable for the period 1st April 2020 to 30th June 2020 on their outstanding household loans with commercial banks. Mauritius website is tempramental, so archived a cached version of the website: http://web.archive.org/web/20200627105454/https://cc.bingj.com/cache.aspx?q=http%3A%2F%2Fmof.govmu.org%2FEnglish%2FCovid-19%2FPages%2Fdefault.aspx&d=5058724365271906&mkt=en-GB&setlang=en-US&w=zob8andH8Xf8cR7Ju8AF6zd4fWrscR-c https://webcache.googleusercontent.com/search?q=cache:http%3A%2F%2Fmof.govmu.org%2FEnglish%2FCovid-19%2FPages%2Fdefault.aspx Original (unarchived, just for reference): http://mof.govmu.org/English/Covid-19/Pages/default.aspx "
Mauritius,MUS,20200404,20200529,H8: Protection of elderly people,2,1,"""All Government actions taken amid the Covid-19 outbreak are geared towards relieving the population from its adverse socio-economic effects and providing support to vulnerable groups. In this context, a home to home payment system of pension to some 58 000 beneficiaries, comprising the elderly, people with disabilities and the vulnerable, is being implemented since yesterday so as to contain the risk of transmission."" - 4 April 2020    http://web.archive.org/web/20210122060917/http://www.govmu.org/English/News/Pages/Covid-19-Additional-social-measures-to-support-and-protect-vulnerable-groups.aspx"
Mauritius,MUS,20200424,20201012,H6: Facial Coverings,3,1,"The government announced on April 24, 2020 that wearing masks would be mandatory for all citizens in public spaces.    Sources: http://web.archive.org/web/20200904201933/http://www.govmu.org/English/News/Pages/Covid-19-Post-confinement-will-be-phase-wise,-says-PM.aspx  https://masks4all.co/what-countries-require-masks-in-public/ (unable to archive)"
Mauritius,MUS,20200501,20200531,E1: Income support,0,,"The Government Wage Assistance Scheme (GWAS/SEAS) have ended on 30 Apr. See the note of 1 Mar. https://web.archive.org/web/20200626194901/https://www.imf.org/en/Topics/imf-and-covid19/Policy-Responses-to-COVID-19 https://web.archive.org/web/20200627102230/https://www.edbmauritius.org/media/3163/communique_extension_of_gwas_and_seas.pdf KPMG Mauritius government response: http://archive.vn/YjFAf"
Mauritius,MUS,20200507,,H3: Contact tracing,2,,"It seems like contract tracing is comprehensive rather than limited. Since the time the number of cases climbed steadily and reached 128 on 30 March, health services prioritised contact tracing to identify people to test – that is, people who had been in physical contact with infected and identified patients – while anybody who had been quarantined and showed symptoms suggestive of COVID-19 infection was also tested. See: https://web.archive.org/web/20200521205121/https://voxeu.org/article/mauritian-response-covid-19"
Mauritius,MUS,20200515,20200611,C2: Workplace closing,2,1,"As from 15 May 2020, more businesses will be allowed to operate, namely bakeries, hardware stores and fish markets and the opening hours of supermarkets will be extended to 20 00 hrs. Banks will continue to operate under strict hygiene protocol. Moreover, work from home will also be encouraged for officers. Dentists, opticians, vegetable planters and fishermen, amongst others, can also return to their normal activities while respecting strict hygiene measures.See: https://web.archive.org/web/20200521205817/http://www.govmu.org/English/News/Pages/Covid-19-Curfew-extended-to-1st-June-and-schools-to-remain-closed-till-1st-August.aspx"
Mauritius,MUS,20200530,20210309,C6: Stay at home requirements,0,,"Per May 30th policy ""These include: citizens will be able to go out without abiding to the alphabetical order rule; the Work Access Permit will not be used; the elderly and those who have a weak health will have to avoid rush hours to travel; those aged under 18 will be able to go out; day care centres and nurseries will be allowed to operate; and trades such as supermarkets will be able to operate on a normal hour basis without having to necessarily respect the alphabetical order rule.""    https://web.archive.org/web/20200617152934/http://www.govmu.org/English/News/Pages/Covid-19-Mauritius-to-lift-curfew-on-30-May-2020,-at-midnight,-says-PM.aspx"
Mauritius,MUS,20200530,20210309,C7: Restrictions on internal movement,0,,"Per May 30th policy ""These include: citizens will be able to go out without abiding to the alphabetical order rule; the Work Access Permit will not be used; the elderly and those who have a weak health will have to avoid rush hours to travel; those aged under 18 will be able to go out; day care centres and nurseries will be allowed to operate; and trades such as supermarkets will be able to operate on a normal hour basis without having to necessarily respect the alphabetical order rule.""    https://web.archive.org/web/20200617152934/http://www.govmu.org/English/News/Pages/Covid-19-Mauritius-to-lift-curfew-on-30-May-2020,-at-midnight,-says-PM.aspx"
Mauritius,MUS,20200530,20210309,H8: Protection of elderly people,1,1,"""Covid-19: Mauritius to lift curfew on 30 May 2020, at midnight, says PM""    ""These include: citizens will be able to go out without abiding to the alphabetical order rule; the Work Access Permit will not be used; the elderly and those who have a weak health will have to avoid rush hours to travel; those aged under 18 will be able to go out; day care centres and nurseries will be allowed to operate; and trades such as supermarkets will be able to operate on a normal hour basis without having to necessarily respect the alphabetical order rule.""    https://web.archive.org/web/20200617152934/http://www.govmu.org/English/News/Pages/Covid-19-Mauritius-to-lift-curfew-on-30-May-2020,-at-midnight,-says-PM.aspx"
Mauritius,MUS,20200601,20200614,E1: Income support,1,1,"All companies in Mauritius can apply for Wage Assistance subsidy to alleviate the employee cost for the month of March ranging from  15 days basic wage bill to MUR 12,500 per employee. Workers from the informal sector, i.e self employed not registered with the revenue authority will get 50% of the prevailing minimum wage if they register with the revenue authority during the COVID19 lockdown. Priority sectors for assistance are travel and tourism sector, export-oriented enterprises, ICT/BPO sector, SMEs and other sectors of the economy, who become technically unemployed on a temporary basis due to the impact of the Coronavirus. KPMG archived government and institution measures: http://archive.vn/YjFAf "
Mauritius,MUS,20200601,20201029,H2: Testing policy,3,,"Covid-19: Mauritius rolls out mass testing Government website https://archive.vn/QTC49"
Mauritius,MUS,20200612,20210309,C2: Workplace closing,0,,"""After 47 days without any new local Covid-19 case, all economic and social activities can now resume and we should be proud of the way we have tackled the situation, stated the Prime Minister, Mr Pravind Kumar Jugnauth, this evening, in a press conference at the Treasury Building in Port Louis.  The Prime Minister announced that following the Cabinet Meeting today, decision has been taken for the lift of all business and activity lockdowns ordered earlier to cope with the Covid-19, as from Monday 15 June 2020. Consequently, beaches, markets, gyms, parks, Village Halls, Community Centres, cinema and other public places will now be accessible to the public but the wearing of masks will still be compulsory.""    https://web.archive.org/web/20200617154020/http://www.govmu.org/English/News/Pages/Covid-19-We-should-be-proud-of-the-way-we-have-tackled-the-situation,-says-PM.aspx"
Mauritius,MUS,20200612,20210307,C3: Cancel public events,0,,"""The Prime Minister announced that following the Cabinet Meeting today, decision has been taken for the lift of all business and activity lockdowns ordered earlier to cope with the Covid-19, as from Monday 15 June 2020. Consequently, beaches, markets, gyms, parks, Village Halls, Community Centres, cinema and other public places will now be accessible to the public but the wearing of masks will still be compulsory.""    https://web.archive.org/web/20200617154020/http://www.govmu.org/English/News/Pages/Covid-19-We-should-be-proud-of-the-way-we-have-tackled-the-situation,-says-PM.aspx"
