CountryName,CountryCode,StartDate,EndDate,PolicyType,PolicyValue,Flag,InitialNote
Argentina,ARG,20210316,20210322,C4: Restrictions on gatherings,3,1,"Indoor cultural, social, recreational, religious, and family events are limited to 20 people. Outdoor cultural, social, recreational, and religious events are limited to 100 people.   https://www.garda.com/crisis24/news-alerts/449296/argentina-authorities-extend-international-travel-and-domestic-covid-19-restrictions-through-march-12-update-28  I cant get this page to web archive"
Argentina,ARG,20210323,20210503,C4: Restrictions on gatherings,4,0,"For those regions in quarantine, the citizens must remain in their homes, only leaving for essentials such as food, medicine, and cleaning supplies.     https://web.archive.org/web/*/https://www.argentina.gob.ar/coronavirus/aislamiento  https://web.archive.org/web/*/https://ar.usembassy.gov/covid-19/"
Argentina,ARG,20210406,20210607,C1: School closing,3,0,"The measures will see schools closed in Greater Buenos Aires from Monday, and the suspension of indoor sports, recreational, religious and cultural activities until April 30.  https://web.archive.org/web/20210503131217/https://www.reuters.com/world/americas/argentine-president-cleared-following-bout-covid-19-2021-04-15/"
Argentina,ARG,20210406,20210613,H7: Vaccination policy,3,1,"A,B,C:  sinopharm, Sputnik 5, Astra Zeneca, covishield  https://web.archive.org/web/20210503130248/https://www.argentina.gob.ar/coronavirus/medidas-gobierno  https://web.archive.org/web/20210503130519/https://www.argentina.gob.ar/coronavirus/vacuna/cuales"
Argentina,ARG,20210504,,C4: Restrictions on gatherings,4,1,"Social gatherings in private homes of more than 10 people are suspended throughout the country. Article 5b from presidential decree.    Source: https://web.archive.org/web/20210509150648/https://www.boletinoficial.gob.ar/detalleAviso/primera/243849/20210501"
Argentina,ARG,20210504,20210521,C5: Close public transport,2,1,"Public transport can only be used by people from specific groups. Article 23 from presidential decree.    Source: https://web.archive.org/web/20210509150648/https://www.boletinoficial.gob.ar/detalleAviso/primera/243849/20210501"
Argentina,ARG,20210504,,C8: International travel controls,4,,"The borders remain closed until May 21 according to article 30 of the presidential decree.    Source: https://web.archive.org/web/20210509150648/https://www.boletinoficial.gob.ar/detalleAviso/primera/243849/20210501"
Argentina,ARG,20210522,,C5: Close public transport,2,0,"Traffic restrictions prohibit citizens from circulating, with exceptions.    Source: https://web.archive.org/web/20210523075012/https://www.boletinoficial.gob.ar/detalleAviso/primera/244721/20210522"
Argentina,ARG,20210608,,C1: School closing,2,0,"Face-to-face classes are resumed at some levels and some locations.    https://web.archive.org/web/20210613185459/https://www.clarin.com/sociedad/axel-kicillof-anuncio-regresan-clases-presenciales-provincia-buenos-aires-vuelta-aulas_0_Qa6JGmpna.html"
Argentina,ARG,20210614,20210621,H7: Vaccination policy,4,1,"The public monitor shows that more than 1 million doses were applied to people without risk factors and who do not belong to key groups, which allows to conclude that the availability was expanded.    https://web.archive.org/web/20210621123720/https://www.argentina.gob.ar/coronavirus/vacuna/aplicadas     Administering Sputnik V, Sinopharm and Astrazeneca  https://web.archive.org/web/20210621124453/https://www.telam.com.ar/notas/202106/558453-argentina-vacunas-coronavirus-astrazeneca-estados-unidos-sinopharm-aerolineas-china.html"
Argentina,ARG,20210622,,C3: Cancel public events,2,0,"The measures are extended again, this time until July 9.    https://web.archive.org/web/20210627125413/https://www.perfil.com/noticias/actualidad/el-gobierno-oficializo-la-prorroga-por-dnu-de-las-restricciones-y-limito-el-ingreso-al-pais.phtml    https://web.archive.org/web/20210627130055/https://www.boletinoficial.gob.ar/detalleAviso/primera/246098/20210626"
Argentina,ARG,20210622,,H7: Vaccination policy,3,1,"Six million people are waiting for the second dose of Sputnik and the Government still does not know when they will arrive.    https://web.archive.org/web/20210627130935/https://www.infobae.com/politica/2021/06/23/seis-millones-de-personas-esperan-la-segunda-dosis-de-sputnik-y-el-gobierno-aun-no-sabe-cuando-llegaran/"
Dominica,DMA,20200322,20200327,C8: International travel controls,1,,"Please note, there is evidence that before the ban there were screening measures. However, I cannot find any evidence for dates. I am assuming this was at least from the first case."
Dominica,DMA,20200322,,H1: Public information campaigns,2,1,"Original:  This data point is copied from the previous contributor; I could not find a source confirming when the campaign might have started. /web/20200421013223/http://dominica.gov.dm/corona  Dowling:  Website does not have a launch date but does say ""March 2020"" near the footer "
Dominica,DMA,20200322,20200419,H2: Testing policy,2,,"""It has been 28 days since Dominica had its last positive case. McIntrye says this is largely due to the closure of the country’s borders, effective contact tracing and isolation, an efficient primary healthcare team, the ability to have in-country testing, compliance by the public and the team effort involving all stakeholders."" Source: https://web.archive.org/web/20200510035220/https://dominicanewsonline.com/news/homepage/news/adjusting-restrictive-measures-does-not-mean-business-as-usual-says-health-minister/"
Dominica,DMA,20200322,20210222,H3: Contact tracing,2,,"""It has been 28 days since Dominica had its last positive case. McIntrye says this is largely due to the closure of the country’s borders, effective contact tracing and isolation, an efficient primary healthcare team, the ability to have in-country testing, compliance by the public and the team effort involving all stakeholders."" Source: https://web.archive.org/web/20200510035220/https://dominicanewsonline.com/news/homepage/news/adjusting-restrictive-measures-does-not-mean-business-as-usual-says-health-minister/"
Dominica,DMA,20200323,20200906,C1: School closing,3,1,"23 March: “With the revelation of the first imported case, we have moved from level one to level two. Against that background, I am making a decision to suspend all classes of school from tomorrow (Monday March 23, 2020),” the prime minister announced.  Video of announcement: /web/20200421012143/https://dominicanewsonline.com/news/homepage/news/covid-19-skerrit-suspends-classes-asks-elderly-and-medically-vulnerable-to-stay-home/"
Dominica,DMA,20200323,20210524,H8: Protection of elderly people,1,1,"The Prime Minister held a news conference on 23 Mar 2020 and asked anyone over age 70 to stay home.   ” I am asking all persons over the age of 70 years old or any person who has an underlying that is not being managed properly to stay at home and minimize contact with the general public,”   https://web.archive.org/web/20201208184715/https://dominicanewsonline.com/news/homepage/news/covid-19-skerrit-suspends-classes-asks-elderly-and-medically-vulnerable-to-stay-home/    The government website now lists recommendations as well, so I am leaving this as in place from 23 March 2020 onward.   Recommendations:   Keep the elderly home to reduce their risk of getting sick.  To protect the elderly against COVID19, limit visitors, especially those that are sick.  To protect against COVID19 keep elderly in a well ventilated room.  https://web.archive.org/web/20201028144106/https://dominica.gov.dm/tips-to-protect-self-family  "
Dominica,DMA,20200328,20200331,C8: International travel controls,3,,"28 March: All air and sea ports shall, except in relation to air; and sea cargo, remain closed to the arrival of aircraft or ships or other vessels carrying passengers. Then extended by State of Emergency until May 11  https://dominicanewsonline.com/news/homepage/news/breaking-news-dominica-imposes-curfew-as-it-tightens-measures-to-fight-coronavirus/      Please note, there is evidence that before the ban there were screening measures. However, I cannot find any evidence for dates. I am assuming this was at least from the first case."
Dominica,DMA,20200401,20200506,C2: Workplace closing,3,1,"STATE OF EMERGENCY DECLARED  People should not leave their homes unless for accessing or providing essential services  https://dominicanewsonline.com/news/homepage/breaking-news-state-of-emergency-declared-in-dominica/    Now extended up to May 11"
Dominica,DMA,20200401,20200626,C3: Cancel public events,2,1,"On 1 April, Dominica announced a State of Emergency with curfew between 6pm to 6am on weekdays and total curfew during weekends. Under this, no person shall host or attend any public or private events.  Source: https://web.archive.org/web/20200427194329/https://dominicanewsonline.com/news/wp-content/uploads/2020/04/SRO-No.-15-Emergency-Powers-Curfew-Order-2020.pdf.pdf    On 6 April, the state of emergency was extended for another three months and the curfew restrictions another 21 days past April 20th.  Source: https://web.archive.org/web/20200427193911/https://www.dominicavibes.dm/news-263824/"
Dominica,DMA,20200401,20200626,C4: Restrictions on gatherings,4,1,"On 1 April, Dominica announced a State of Emergency with curfew between 6pm to 6am on weekdays and total curfew during weekends. Under this, no person shall host or attend -  (a) a private party which includes any person from outside of the immediate household of the house occupant; (b) a recreational or competitive sporting event; (c) a wedding which hosts five or more persons other than the bride, bridegroom, official witnesses and the marriage officer; (d) any social event; (e) a funeral, except ten members of the immediate family and at least one    officiant and essential mortuary staff; or (f) a meeting of a fraternal society, private or social club  or civic association or organisation  Source: https://web.archive.org/web/20200427194329/https://dominicanewsonline.com/news/wp-content/uploads/2020/04/SRO-No.-15-Emergency-Powers-Curfew-Order-2020.pdf.pdf    On 6 April, the state of emergency was extended for another three months and the curfew restrictions another 21 days past April 20th.  Source: https://web.archive.org/web/20200427193911/https://www.dominicavibes.dm/news-263824/"
Dominica,DMA,20200401,20200511,C6: Stay at home requirements,2,1,"On 1 April, Dominica announced a State of Emergency with curfew between 6pm to 6am on weekdays and total curfew during weekends. Source: https://web.archive.org/web/20200427194329/https://dominicanewsonline.com/news/wp-content/uploads/2020/04/SRO-No.-15-Emergency-Powers-Curfew-Order-2020.pdf.pdf     Curfew has been extended until May 11. Source: https://web.archive.org/web/20200510032514/https://www.eturbonews.com/571939/dominica-official-covid-19-tourism-update-3/"
Dominica,DMA,20200401,20200626,C7: Restrictions on internal movement,1,1,"On 1 April, Dominica announced a State of Emergency with curfew between 6pm to 6am on weekdays and total curfew during weekends. Source: https://web.archive.org/web/20200427194329/https://dominicanewsonline.com/news/wp-content/uploads/2020/04/SRO-No.-15-Emergency-Powers-Curfew-Order-2020.pdf.pdf     The restrictions in place do not technically restrict internal movement (""motor omnibuses, hiring cars and taxis may operate between 6:00 a.m. to 5:00 p.m""), instead limiting transportation, so this is coded as a 1G.    Curfew has been extended until May 12. Source: https://web.archive.org/web/20200510032514/https://www.eturbonews.com/571939/dominica-official-covid-19-tourism-update-3/"
Dominica,DMA,20200401,20200806,C8: International travel controls,4,,"11. (1) With immediate effect -  (a) except with the prior written permission of the Minister responsible for National Security, all airports shall be closed to incoming flights carrying any visitor;  (b) all seaports shall be closed to seafaring and private boating; and  (c) no visitor shall be permitted to enter and disembark for any reason, including transiting through the State of Dominica.  https://dominicanewsonline.com/news/homepage/breaking-news-state-of-emergency-declared-in-dominica/"
Dominica,DMA,20200416,20200930,H6: Facial Coverings,3,1,"The use of medical face masks has been mandatory since April 16   •	 https://web.archive.org/web/20200905021346/https://dominicantoday.com/dr/covid-19/2020/06/22/coronavirus-dr-those-who-do-not-wear-masks-would-pay-fines-between-10000-us-178-and-100000-pesos-us-1728/  "
Dominica,DMA,20200420,20201206,H2: Testing policy,3,,"""With the contact tracing list exhausted and positive cases seemingly in hand, the Ministry of Health says it has moved to testing random individuals for the new coronavirus."" Source: https://web.archive.org/web/20200428033459/https://www.dominicavibes.dm/news-264073/"
Dominica,DMA,20200507,20200626,C2: Workplace closing,2,1,"""Dominica eases anti-coronavirus restrictions: the ease of restrictions means that appliance and electronic shops and clothing and textile shops can reopen for business, however they must ensure that staff and customers wear face masks, physical distancing protocols are enforced as well as hand sanitization upon entry to and exit from the business place. (...) Bars, night clubs, game shops, hair salons, barber shops, sulphur spas, schools, churches, gyms, manicure and pedicure shops remain closed pending further review on May 11, 2020."" Source: https://web.archive.org/web/20200510032514/https://www.eturbonews.com/571939/dominica-official-covid-19-tourism-update-3/"
Dominica,DMA,20200512,20200626,C6: Stay at home requirements,1,1,"""Relaxing of the restrictive measures, Dr McIntyre said, should only encourage people to continue the public, health and social measures"". Source: https://web.archive.org/web/20200521153035/https://dominicanewsonline.com/news/homepage/homepage-carousel/covid-19-emergency-powers-act-in-dominica-extended-for-two-weeks-some-changes-in-curfew-hours/"
Dominica,DMA,20200519,20210513,E1: Income support,1,1,"""To mitigate the socio-economic impact authorities announced income transfers to the most vulnerable segments and tax relief programs for households and businesses."" Source: https://www.imf.org/en/Topics/imf-and-covid19/Policy-Responses-to-COVID-19#D"
Dominica,DMA,20200519,20200917,E2: Debt/contract relief,2,,"“In most instances customers have the option to defer payments for a period of up to six months and I am advised that many people are taking advantage of that option -the PM said-. We also extended the deadline for the filing of personal and corporate income tax returns, and the payment of income tax was extended by three months for companies with financial year ending in January 2020 to June 2020.” Source: http://www.jamaicaobserver.com/news/dominica-pm-announces-new-initiatives-to-reopen-economy_194394"
Dominica,DMA,20200627,20201206,C2: Workplace closing,0,,"Businesses, shops, offices, churches, sports facilities and beauty salons are now operating normally without restriction, except for health protocols (physical distancing, hand sanitising, wearing face masks). See: https://web.archive.org/web/20200706194429/https://www.gov.uk/foreign-travel-advice/dominica/coronavirus"
Dominica,DMA,20200627,20201109,C3: Cancel public events,1,1,"Possible it is only recommended at this point since gatherings of 250 are allowed. See: https://web.archive.org/web/20200706194429/https://www.gov.uk/foreign-travel-advice/dominica/coronavirus"
Dominica,DMA,20200627,20201109,C4: Restrictions on gatherings,2,1,"A maximum of 250 persons may gather together at any one time. See: https://web.archive.org/web/20200706194429/https://www.gov.uk/foreign-travel-advice/dominica/coronavirus"
Dominica,DMA,20200627,20201206,C6: Stay at home requirements,0,,"Since businesses, shops, offices, churches, sports facilities and beauty salons are now operating normally without restriction, it could be implied that there are no stay at home requirements. See: https://web.archive.org/web/20200706194429/https://www.gov.uk/foreign-travel-advice/dominica/coronavirus"
Dominica,DMA,20200627,,C7: Restrictions on internal movement,0,,"Since businesses, shops, offices, churches, sports facilities and beauty salons are now operating normally without restriction, it could be implied that there are no longer restrictions in place. See: https://web.archive.org/web/20200706194429/https://www.gov.uk/foreign-travel-advice/dominica/coronavirus"
Dominica,DMA,20200807,20201012,C8: International travel controls,1,,"According to the UK embassy website, the borders and airports (Douglas Charles and Canefield) open for nationals and residents on 15 July, and for non-nationals on 7 August. http://web.archive.org/web/20200812234938/https://www.gov.uk/foreign-travel-advice/dominica/coronavirus"
Dominica,DMA,20200907,20201031,C1: School closing,1,1,"Schools reopened on September 7th but with Hygiene wardens, to ensure that proper coronavirus hygiene measures were in place at all times.    Note by Andrey Krachcov:    ""The Dominica Government today announced that all schools will reopen on September 7 as the island continues to implement measures to curb the spread of the coronavirus (COVID-19) which has infected 18 people here.""  “So, we are hoping that by next week Monday, hopefully the guidelines will be in circulation (and) one of the areas we are going to be focusing upon very heavily during the academic year is that of hygiene and the importance of effective hygiene practices…and for that matter we will engage hygiene wardens to ensure that students do what they have to do in terms of entry at the school gates,” he said.    https://web.archive.org/web/20200917070003/http://www.jamaicaobserver.com/latestnews/Dominican_schools_to_reopen_September_7?profile=1754    "
Dominica,DMA,20200918,20201206,E2: Debt/contract relief,0,,"Can't find any evidence of ongoing contract relief. Policies like ""extension of three months for payment of corporate income tax"" have since ended (June) and can't find evidence of any recent applicable policies.    http://web.archive.org/web/20201001044535/https://www.imf.org/en/Topics/imf-and-covid19/Policy-Responses-to-COVID-19"
Dominica,DMA,20201001,20201012,H6: Facial Coverings,2,1,
Dominica,DMA,20201013,,C8: International travel controls,2,,"The government has released a list of countries within the CARICOM travel bubble, low risk, medium risk, and high risk. Depending on the risk level there are different procedures that must be followed. The strictest protocol applies to those coming from high risk countries: These individuals must quarantine for 5 days and receive a PCR test on day 5, if positive they must continue quarantining.  https://web.archive.org/web/20201021161244/https://dominica.gov.dm/images/documents/Travelprotocols_Portrait_Aug25_Rev6b.pdf"
Dominica,DMA,20201013,20201221,H6: Facial Coverings,3,1,"Masks are required in public  https://web.archive.org/web/20201021161909/https://www.gov.uk/foreign-travel-advice/dominica/coronavirus"
Dominica,DMA,20201101,20201109,C1: School closing,3,0,"A school was forced to close because of covid exposure:    "" The Dominica government has ordered the closure of a secondary school, the mandatory wearing of masks and the banning of mass events, as the island recorded eight new cases of the coronavirus (COVID-19) on Friday, pushing its total to date to 50.    Education Minister Octavia Alfred said that the decision to temporary shutdown the Isiah Thomas Secondary School (ITSS) in St, Joseph became necessary after a teacher at the institution tested positive for the virus.    “It has been confirmed that a staff member…has tested positive for the COVID-19 virus. The teacher is presently admitted at the COVID isolation facility. Ministry of Health officials have been at the school carrying out testing on staff members and students.    “The Ministry of Education is offering support to the entire staff and student body as we continue to follow directives from the Ministry of Health,” she said, adding that all relevant stakeholders, including the Dominica Association of Teachers have been made aware of the situation.    ‘As part of our precautionary measures, ITSS will be closed until November 6. We are hopeful that school will resume by November 9, 2020,” she added.""    https://web.archive.org/web/20201123193643/https://www.caribbeannationalweekly.com/caribbean-breaking-news-featured/secondary-school-closes-as-dominica-records-increased-cases-of-covid/"
Dominica,DMA,20201110,20201221,C1: School closing,1,1,"School rules resumed"
Dominica,DMA,20201110,20201206,C3: Cancel public events,0,,"No policy change"
Dominica,DMA,20201110,20201123,C4: Restrictions on gatherings,1,1,"""Businesses, shops, offices, churches, sports facilities and beauty salons are now operating normally without restriction, except for health protocols (physical distancing, hand sanitising, wearing face masks). A maximum of 250 persons may gather together at any one time. Single visitors are allowed to hospital patients and nursing home residents. Beaches and rivers can be freely accessed and sporting activities allowed.""    https://www.gov.uk/foreign-travel-advice/dominica/coronavirus      ***ARCHIVING WEBSITE WAS NOT WORKING"
Dominica,DMA,20201110,20201123,C5: Close public transport,2,1,"No policy change"
Dominica,DMA,20201124,20201130,C4: Restrictions on gatherings,2,1,"As of Oct 28, 2020, approval for public gathers is contingent upon several conditions being met, one being that no more than 250 people be present, including event staff. Official legislation forthcoming that will prohibit gatherings of 200+ people.  https://web.archive.org/web/20201201183939/https://www.loopnewscaribbean.com/content/dominica-implements-stringent-event-rules-week-independence  "
Dominica,DMA,20201124,,C5: Close public transport,0,,"I've seen no indication of bus closures; to the contrary, masks are required when riding the bus. Thus, I'm indicating ""no measures"" but would welcome seeing any reporting to the contrary, as I don't want to code this inaccurately.   https://web.archive.org/web/20201201151147/https://discoverdominica.com/en/island-transportation#:~:text=Dominica%2520has%2520a%2520reliable%2520public,%252410.25%2520according%2520the%2520specific%2520route.  "
Dominica,DMA,20201201,20201206,C4: Restrictions on gatherings,1,1,"""A maximum of 250 persons may gather together at any one time.""     https://web.archive.org/web/20201205233138/https://www.gov.uk/foreign-travel-advice/dominica/coronavirus"
Dominica,DMA,20201207,20201221,C2: Workplace closing,1,1,"Establishments such as restaurants and bars, where tables cannot be occupied by more than 10 people and always respecting the sanitary protocols of the sector, such as not exceeding 70% of the total capacity of the premises.  Please see: https://web.archive.org/web/20201221140355/https://presidencia.gob.do/noticias/la-portavoz-de-la-presidencia-detalla-el-alcance-de-las-medidas-del-toque-de-queda"
Dominica,DMA,20201207,20201221,C3: Cancel public events,2,1,"“Regarding the gathering of people, it has been prohibited for more than 10 people to gather in public and private spaces for public use. This means that in these spaces more than 10 people can coincide at the same time, but they cannot gather in groups larger than that amount, as would happen in a shopping plaza, a transport station or a park ”.  Please see:   https://web.archive.org/web/20201221140355/https://presidencia.gob.do/noticias/la-portavoz-de-la-presidencia-detalla-el-alcance-de-las-medidas-del-toque-de-queda  Gatherings of between 50 and 199 people needs to be permitted by the chief of police. Please see: https://web.archive.org/web/20201221142001/https://dominicanewsonline.com/news/homepage/news/police-reiterate-warning-against-mass-gatherings-minister-refuses-to-confirm-or-deny-talk-of-more-stringent-measures/     There is an application form. See: https://web.archive.org/web/20201221135749/http://dominica.gov.dm/images/documents/Safe_Event_Checklist_Rev_2_Nov_1220_v4.pdf"
Dominica,DMA,20201207,20201221,C4: Restrictions on gatherings,3,1,"According to the Director of Communication and spokesperson for the Presidency, Milagros Germán, “Regarding the gathering of people, it has been prohibited for more than 10 people to gather in public and private spaces for public use. This means that in these spaces more than 10 people can coincide at the same time, but they cannot gather in groups larger than that amount, as would happen in a shopping plaza, a transport station or a park ”.    The same restriction applies to establishments such as restaurants and bars, where tables cannot be occupied by more than 10 people and always respecting the sanitary protocols of the sector, such as not exceeding 70% of the total capacity of the premises. Please see: https://web.archive.org/web/20201221140355/https://presidencia.gob.do/noticias/la-portavoz-de-la-presidencia-detalla-el-alcance-de-las-medidas-del-toque-de-queda     However, there is an application form that needs to be filled if one intends to host a gathering of between 50 and 199 people. Please see: https://web.archive.org/web/20201221135749/http://dominica.gov.dm/images/documents/Safe_Event_Checklist_Rev_2_Nov_1220_v4.pdf  "
