CountryName,CountryCode,StartDate,EndDate,PolicyType,PolicyValue,Flag,InitialNote
Fiji,FJI,20210804,,H7: Vaccination policy,5,1,"AstraZeneca, Moderna  All individuals aged 18 years and above can receive the COVID-19 vaccine.    https://web.archive.org/web/20210812075132/https://www.health.gov.fj/covid-19-vaccination-campaign/"
Fiji,FJI,20210804,,H8: Protection of elderly people,1,1,"The Fijian government is encouraging most people to work from home, and to leave their houses only if essential.    https://archive.vn/G61dg"
Fiji,FJI,20210812,20210919,V2: Vaccine Availability,20732,,"On August 12, 2021, the Fiji government begins priority for Moderna COVID-19 vaccines to the following group of high risk individuals:  - Pregnant women;  - Individuals aged 60 years and above;  - Persons with comorbid issues such as hypertension, asthma, chronic lung disease, cardiac disease, severe obesity, diabetes, liver disease;  - Persons with Rheumatic Heart Disease; and  - Human immunodeficiency virus (HIV) infection and persons with disability.    As of July 20th, a total of 401,404 Fijians or 68.4% of the target population have received their first dose of the AstraZeneca vaccine, while 80,895 people (13.8%) have received both jabs.  The government is urging encouraging residents and especially those in the above high risk groups to get the Moderna vaccine after record daily infections and deaths recorded. Fiji will begin administering the Moderna vaccine after more than 150,000 doses of the vaccine arrived in Fiji through the US government and the COVAX Facility.    https://web.archive.org/web/20211004050633/https://www.fiji.gov.fj/Media-Centre/News/MODERNA-COVID-19-VACCINE-PRIORITY-GROUPS-FOR-VITI  https://web.archive.org/web/20211004050937/https://www.rnz.co.nz/international/pacific-news/447293/fijians-urged-to-vaccinate-as-moderna-arrives  https://web.archive.org/web/20211004020435/https://www.health.gov.fj/covid-vaccine/vaccine-faqs/"
Fiji,FJI,20210812,20210919,V3: Vaccine Financial Support,20732,,"All vaccines administered are provided as a part of the COVAX initiative and free to the public    https://web.archive.org/web/20210614193410/https://www.health.gov.fj/covid-vaccine/vaccine-faqs/"
Fiji,FJI,20210817,20210913,H3: Contact tracing,1,,"No explicit change in policy but daily media releases no longer report contact tracing numbers.    https://web.archive.org/web/20210914225615/https://www.health.gov.fj/23-08-2021/"
Fiji,FJI,20210914,20211018,C5: Close public transport,2,0,"Travel restrictions have been in place in Fiji following a COVID-19 outbreak. Scheduled international and domestic passenger flights have been suspended though some outbound “Special flights” are being operated by Fiji Airways. The main island of Viti Levu has two “containment zones” one covering the Greater Suva Area and one covering the Nadi/Lautoka area in the west. Travel into and out of these zones is restricted. The Fijian Government continues with targeted of lockdown of areas where existing clusters of COVID-19 exist. Some boat services to and from Viti Levu remain suspended but some journeys have been approved under tight controls.    https://web.archive.org/web/20211004210351/https://www.gov.uk/foreign-travel-advice/fiji/coronavirus"
Fiji,FJI,20210914,,H3: Contact tracing,2,,"The maintenance of contact tracing records and is required and use of careFIJI app is mandatory.  https://web.archive.org/web/20210531142411/https://www.mcttt.gov.fj/wp-content/uploads/2021/02/Fijian-COVID-Safe-Economic-Recovery-Framework_-Rev-3.pdf"
Fiji,FJI,20210920,20211003,V2: Vaccine Availability,22979,,"On September 20, the Fiji government begins administering Moderna vaccination rollouts to school clusters with all four divisions. These vaccines will be administered to students age 15 to 17 years old. Vaccinations for those 12 to 14  year olds will be announced at a later date.  As of Sep 16, 580,504 Fijians, or 97.7 % of adults in Fiji have received their first dose of a COVID-19 vaccine and 372,434 or 63.5% have received their second dose.    https://web.archive.org/web/20211004051956/https://www.health.gov.fj/vaccine-for-children/  https://web.archive.org/web/20211004052051/https://www.health.gov.fj/children-15-17/  https://web.archive.org/web/20211004020435/https://www.health.gov.fj/covid-vaccine/vaccine-faqs/  https://web.archive.org/web/20211004052139/https://www.health.gov.fj/covid-19-vaccination-campaign/"
Fiji,FJI,20210920,20211003,V3: Vaccine Financial Support,22979,,"vaccines free of charge.   https://web.archive.org/web/20211004052051/https://www.health.gov.fj/children-15-17/ "
Fiji,FJI,20211004,20211220,V2: Vaccine Availability,20735,,"From 4 October onwards, children ages 15+ in schools are also being vaccinated.     https://web.archive.org/web/20211004052051/https://www.health.gov.fj/children-15-17/ "
Fiji,FJI,20211004,20211220,V3: Vaccine Financial Support,20735,,"vaccines free of charge.   https://web.archive.org/web/20211004052051/https://www.health.gov.fj/children-15-17/ "
Fiji,FJI,20211019,20211231,C2: Workplace closing,3,1,"Restrictions on some sectors; routine and emergency medical services may not be available at the time needed; containment zone restrictions have been lifted on Viti Levu, but remain in effect for other islands; nationwide curfew from 11 p.m. to 4 a.m.; source: /web/20211105154639/https://fj.usembassy.gov/u-s-citizen-services/covid-19-information/"
Fiji,FJI,20211019,20220109,C5: Close public transport,2,1,"containment zone restrictions have been lifted on Viti Levu, but remain in effect for other islands; nationwide curfew from 11 p.m. to 4 a.m.; source: /web/20211105154639/https://fj.usembassy.gov/u-s-citizen-services/covid-19-information/"
Fiji,FJI,20211019,20220116,C7: Restrictions on internal movement,2,1,"The Centers for Disease Control and Prevention (CDC) has issued a Level 3  Travel Health Notice for Fiji due to COVID-19, indicating a high level of COVID-19 in the country; nationwide curfew from 11 p.m. to 4 a.m.; source: /web/20211105154639/https://fj.usembassy.gov/u-s-citizen-services/covid-19-information/"
Fiji,FJI,20211019,20211130,C8: International travel controls,2,,"Fiji Airways has resumed regularly scheduled flights; effective November 8 all non-citizen, nonimmigrant airline passengers must demonstrate proof of vaccination; fully vaccinated travelers will continue to be required to show a pre-departure negative test taken within three (3) days of travel; to further strengthen protections, unvaccinated travelers will now need to test within one (1) day of departure; visitors to Fiji and Fijian citizens are required to quarantine for up to three days; /web/20211105154639/https://fj.usembassy.gov/u-s-citizen-services/covid-19-information/"
Fiji,FJI,20211019,,H2: Testing policy,1,,"PCR and/or antigen tests available; test results available within 72 hours; tests must be taken within 3 days of travel; source: /web/20211105154639/https://fj.usembassy.gov/u-s-citizen-services/covid-19-information/"
Fiji,FJI,20211109,,H6: Facial Coverings,3,1,
Fiji,FJI,20211201,,C8: International travel controls,3,,"If you are from or have stayed in a Travel Partner Country for at least 14 days before travel to Fiji, please produce proof of the following at the airport before your departure for Fiji:?   1) Vaccinations2 ) COVID-19 Tests3) CFC Hotel Booking & Travel Insurance  All visitors travelling to Fiji from a Non-Travel Partner country will also need to stay in a Fiji Managed Quarantine Facility.  Based on the country’s respective COVID-19 situation, additional escalated protocols may apply.  https://web.archive.org/web/20220126183338/https://www.fiji.travel/faq"
Fiji,FJI,20211221,,C4: Restrictions on gatherings,3,1,"“So, to be clear, indoor events in venues with four walls with more than 20 people need a permit. Outdoor events do not need a permit, but the organisers must enforce COVID-safe measures or they will be shut down.”https://web.archive.org/web/20220116214115/https://www.fijitimes.com/covid-19-fiji-additional-requirements-for-informal-gatherings/"
Fiji,FJI,20211221,20220210,V2: Vaccine Availability,20736,,"Fiji to inoculate children aged 12-14 against COVID-19 from mid-November  https://archive.ph/uDkq4"
Fiji,FJI,20211221,20220210,V3: Vaccine Financial Support,20736,,"Fiji to inoculate children aged 12-14 against COVID-19 from mid-November  https://archive.ph/uDkq4"
Fiji,FJI,20220101,20220206,C2: Workplace closing,3,1,"Government will roll out the digital VAX-Check tool which will be made available to all workplaces, tertiary institutions, houses of worship, hotels, restaurants, cafés, cinemas, gyms, pools and tattoo parlours allowing them to open at 70 per cent capacity but only to fully-vaccinated persons.  https://web.archive.org/web/20220228171934/https://www.fijitimes.com.fj/state-to-roll-out-vax-check-tool/"
Fiji,FJI,20220110,,C3: Cancel public events,2,1,"From tomorrow, informal gatherings in homes, communities, and community halls will be limited to 20 persons.    This is according to a statement released by the Minister for Commerce, Trade, Tourism and Transport, Faiyaz Koya.    He added that other venues which have been approved to operate under COVID-safe measures and or which require Care Fiji Commitment certification, including places of worship and restaurants, can host events, including weddings and other functions, at 80 percent capacity. However, other event venues seeking to host functions, but which do not have formal approval or certification to host events, must become Care Fiji Commitment certified to do so.    https://web.archive.org/web/20220207070654/https://www.fijitimes.com/covid-19-informal-gatherings-limited-to-20-persons-in-homes-communities-and-community-halls/"
Fiji,FJI,20220110,,C5: Close public transport,1,1,"All Public Service Vehicles MUST operate at 80 percent capacity and ensure that all passengers are wearing masks. Interisland vessels must also operate at 80 percent capacity and ensure that all passengers must wear masks.  https://web.archive.org/web/20220207070654/https://www.fijitimes.com/covid-19-informal-gatherings-limited-to-20-persons-in-homes-communities-and-community-halls/  "
Fiji,FJI,20220117,,C7: Restrictions on internal movement,2,1,"Are there restrictions on intercity or interstate travel? Fully vaccinated individuals can travel freely within Fiji or internationally.  https://web.archive.org/web/20220207072640/https://fj.usembassy.gov/u-s-citizen-services/covid-19-information/"
Fiji,FJI,20220124,20220213,C1: School closing,2,1,"Schools in Fiji - closed since April last year - have reopened this week despite a worsening third wave of the coronavirus in the country.  Year 8 to 13 students returned to class on Monday with majority of the schools recording a 60 percent turnout on day one.  https://web.archive.org/web/20220203175540/https://www.rnz.co.nz/international/pacific-news/460217/covid-19-schools-reopen-amid-third-wave-in-fiji  "
Fiji,FJI,20220207,,C2: Workplace closing,3,1,"PROTOCOL FOR COVID SAFE RESTAURANTS, CAFÉS AND FOOD COURTS OPERATION  Revised, Effective from 7 February 2022  1. All eligible persons (employees, customers and clients) must be fully vaccinated. Only in exceptional circumstances where an exemption letter is provided by the Ministry of Health and Medical Services (MHMS), an unvaccinated person can enter.     https://archive.ph/QzrkN"
Fiji,FJI,20220207,,C6: Stay at home requirements,0,,"The nationwide daily curfew from 12am to 4am has been completely lifted beginning from tonight.    Attorney-General Aiyaz Sayed-Khaiyum made the announcement in a press conference this afternoon.    Mr Sayed-Khaiyum said the curfew will not be moved nor shifted but lifted completely.    He said curfew was implemented to prevent non-essential gatherings that can spread the COVID-19 virus and allow for reliable contact tracing at certain hours in the evening.  https://web.archive.org/web/20220207072252/https://www.fijitimes.com/nationwide-curfew-completely-lifted/"
Fiji,FJI,20220211,,V2: Vaccine Availability,23369,,"Booster dose for individuals aged 18 years and above  First and second doses of the COVID-19 vaccines for individuals aged 18 years and above  First and second dose of the COVID-19 vaccines for individuals aged 15-17 years old  https://web.archive.org/web/20210603011909/https://www.health.gov.fj/covid-19-vaccination-campaign/"
Fiji,FJI,20220211,,V3: Vaccine Financial Support,23369,,"Booster dose for individuals aged 18 years and above  First and second doses of the COVID-19 vaccines for individuals aged 18 years and above  First and second dose of the COVID-19 vaccines for individuals aged 15-17 years old  https://web.archive.org/web/20210603011909/https://www.health.gov.fj/covid-19-vaccination-campaign/"
Fiji,FJI,20220214,,C1: School closing,0,,"The Ministry of Education, Heritage and Arts announces that after a week’s closure of schools in the Western Division last week because of inclement weather, all schools will open from today. This means all schools throughout Fiji will now be open for classes for ECE to year 13.  https://web.archive.org/web/20220307032142/https://www.fijitimes.com/all-schools-open-from-today/"
Luxembourg,LUX,20200301,20200311,H2: Testing policy,2,,"First confirmed case, the Ministry for health reports the patient coming from Northern Italy has followed their guidelines and come in for testing after developing symptoms.   https://web.archive.org/save/https://coronavirus.gouvernement.lu/en/communications-officielles.gouvernement%2Ben%2Bactualites%2Btoutes_actualites%2Bcommuniques%2B2020%2B03-mars%2B01-premier-cas-corona.html"
Luxembourg,LUX,20200301,,H3: Contact tracing,2,,"First case of COVID on March 1st has been reported and the a team of sanitary inspectors have ""retracer son entourage"", traced whom he has been in contact with. https://web.archive.org/save/https://coronavirus.gouvernement.lu/en/communications-officielles.gouvernement%2Ben%2Bactualites%2Btoutes_actualites%2Bcommuniques%2B2020%2B03-mars%2B01-premier-cas-corona.html"
Luxembourg,LUX,20200305,,H1: Public information campaigns,2,1,"Opening of a dedicated Site for information relating to COVID and the states response. Mentioned initially in a facebook post on the 28th of February. Site seems to have gone online on 5th of February. www.gouvernement.lu/coronavirus was the initial site, moving to covid19.lu on the 23rd of March.      https://www.infocrise.lu/fr/web/guest/accueil/-/asset_publisher/uJAlpeXURbmf/content/toutes-les-informations-officielles-et-utiles-regroupe-sur-covid19-lu?inheritRedirect=false&redirect=https%3A%2F%2Fwww.infocrise.lu%2Ffr%2Fweb%2Fguest%2Faccueil%3Fp_p_id%3D101_INSTANCE_uJAlpeXURbmf%26p_p_lifecycle%3D0%26p_p_state%3Dnormal%26p_p_mode%3Dview%26p_p_col_id%3Dcolumn-1%26p_p_col_count%3D1%23article_78291#p_101_INSTANCE_uJAlpeXURbmf"
Luxembourg,LUX,20200309,20200312,C3: Cancel public events,1,1,"Recommendation from the ministry of health to cancel all events over 1000 participants. Clearly mentions schools, businesses and transportation is not concerned with this. https://www.infocrise.lu/fr/web/guest/accueil/-/asset_publisher/uJAlpeXURbmf/content/covid-19-recommandation-de-la-direction-de-la-sante-concernant-les-evenements-rassemblant-plus-de-1000-personnes-09-03-2020-?inheritRedirect=false&redirect=https%3A%2F%2F  www.infocrise.lu%2Ffr%2Fweb%2Fguest%2Faccueil%3Fp_p_id%3D101_INSTANCE_uJAlpeXURbmf%26p_p_lifecycle%3D0%26p_p_state%3Dnormal%26p_p_mode%3Dview%26p_p_col_id%3Dcolumn-1%26p_p_col_count%3D1%23article_78015#p_101_INSTANCE_uJAlpeXURbmf  ** Archived link - https://web.archive.org/web/20210428071030/https://infocrise.public.lu/fr/actualites/2020/covid19-recommandations-evenements-1000personnes.html"
Luxembourg,LUX,20200309,20200312,C4: Restrictions on gatherings,2,1,"Public gatherings and events are limited to no more than 1000 people  https://archive.fo/wip/q6D2Y"
Luxembourg,LUX,20200312,20200315,C2: Workplace closing,1,1,"Recommendation based on 12 March directive -- Home office should be promoted as far as possible and preferably among the vulnerable population.  https://web.archive.org/save/https://coronavirus.gouvernement.lu/en/communications-officielles.gouvernement%2Ben%2Bactualites%2Btoutes_actualites%2Bcommuniques%2B2020%2B03-mars%2B12-cdg-extraordinaire-coronavirus.html"
Luxembourg,LUX,20200312,20200610,C5: Close public transport,1,1,"The frequency of public transport is being adapted, also based on low ridership to due with other measures that have gone into effect. This is according the the 12th of March declaration. On busy lines during peak hours, more buses are put into service in order to allow for social distancing. Certain lines have stopped running. https://web.archive.org/save/https://coronavirus.gouvernement.lu/en/communications-officielles.gouvernement%2Ben%2Bactualites%2Btoutes_actualites%2Bcommuniques%2B2020%2B03-mars%2B12-cdg-extraordinaire-coronavirus.html https://web.archive.org/save/https://coronavirus.gouvernement.lu/en/communications-officielles.gouvernement%2Ben%2Bactualites%2Btoutes_actualites%2Bcommuniques%2B2020%2B03-mars%2B12-cdg-extraordinaire-coronavirus.html https://www.vdl.lu/en/news/coronavirus-disease-covid-19-public-transport"
Luxembourg,LUX,20200312,20200510,H2: Testing policy,1,,"March 12th Directive article 7, Test only recommended for those with serious symptoms, not everyone showing symptoms as previously  https://web.archive.org/save/https://coronavirus.gouvernement.lu/en/communications-officielles.gouvernement%2Ben%2Bactualites%2Btoutes_actualites%2Bcommuniques%2B2020%2B03-mars%2B12-cdg-extraordinaire-coronavirus.html"
Luxembourg,LUX,20200313,20200524,C3: Cancel public events,2,1,"From March 12th Declaration, article 5: From 13 March and until 31 March until further notice Events in confined spaces with more than 100 people are prohibited Events in non-confined spaces with more than 500 people are prohibited. https://web.archive.org/save/https://coronavirus.gouvernement.lu/en/communications-officielles.gouvernement%2Ben%2Bactualites%2Btoutes_actualites%2Bcommuniques%2B2020%2B03-mars%2B12-cdg-extraordinaire-coronavirus.html  ** Archive link https://web.archive.org/web/20200314035608/https://gouvernement.lu/en/dossiers.gouv_msan%2Ben%2Bdossiers%2B2020%2Bcorona-virus.html refers to a different document, but contains same details - ""As of Friday 13 March 2020, any event in a confined space bringing together more than 100 people and any event in an non-confined space bringing together more than 500 people is prohibited."""
Luxembourg,LUX,20200313,20200510,C4: Restrictions on gatherings,4,1,"The Government moves to cancel all public events   https://archive.fo/wip/q6D2Y"
Luxembourg,LUX,20200315,20200419,C7: Restrictions on internal movement,2,1,"15th of March directive: Traffic on public roads is restricted to a certain number of activities deemed essential including exercising.    https://web.archive.org/save/https://coronavirus.gouvernement.lu/en/communications-officielles.gouvernement%2Ben%2Bactualites%2Btoutes_actualites%2Bcommuniques%2B2020%2B03-mars%2B15-nouvelles-mesures-coronavirus.html"
Luxembourg,LUX,20200316,20200503,C1: School closing,3,1,"Government Measures taken by the Government Council on 12 March 2020, section 4, suspending all activities from Monday the 16th https://web.archive.org/web/20200408104808/https://coronavirus.gouvernement.lu/en/communications-officielles.gouvernement%2Ben%2Bactualites%2Btoutes_actualites%2Bcommuniques%2B2020%2B03-mars%2B12-cdg-extraordinaire-coronavirus.html http://web.archive.org/web/20210118181933/https://www.dailymail.co.uk/news/article-8108427/Luxembourg-latest-European-country-close-schools.html"
Luxembourg,LUX,20200316,20200510,C2: Workplace closing,3,1,"All non-essential commercial activities, including construction work, is suspended. Essential stores are to stay open. Restriction of professional activities   https://web.archive.org/save/https://coronavirus.gouvernement.lu/en/communications-officielles.gouvernement%2Ben%2Bactualites%2Btoutes_actualites%2Bcommuniques%2B2020%2B03-mars%2B15-nouvelles-mesures-coronavirus.html"
Luxembourg,LUX,20200317,20200419,C6: Stay at home requirements,2,1,"From March 17th all residents of Luxembourg are required to stay home, and to only leave for food/medicine/assistance/exercise   https://archive.fo/egPfr"
Luxembourg,LUX,20200317,20201123,E1: Income support,2,1,"Including artists, https://coronavirus.gouvernement.lu/fr/communications-officielles.gouvernement%2Bfr%2Bactualites%2Btoutes_actualites%2Bcommuniques%2B2020%2B03-mars%2B17-secteur-culturel-covid19.html"
Luxembourg,LUX,20200317,20210719,E2: Debt/contract relief,2,,"With regard to direct taxes, the modalities of the advance tax payments and payment deadlines will be adapted for corporations and self-employed persons. More specifically, legal persons and natural persons carrying out an activity generating trade and business income, agriculture and forestry income, or income from independent professional services, who are experiencing liquidity problems due to the Covid-19 pandemic, can apply for a cancellation of the two first quarterly advance tax payments of the year 2020 (due in March and June 2020). Covered by this measure are (corporate) income and municipal business taxes.    In addition, these same persons may request, for taxes due after 29 February 2020, a payment extension of four months. On this deferral, no interest on late payment will be due and it covers (corporate) income, municipal business, and net wealth taxes.  https://mfin.gouvernement.lu/en/actualites.gouvernement%2Ben%2Bactualites%2Btoutes_actualites%2Bcommuniques%2B2020%2B03-mars%2B17-mesures-fiscales-covid19.html"
Luxembourg,LUX,20200317,20200419,H8: Protection of elderly people,2,1,"From March 17th all residents of Luxembourg are required to stay home, and to only leave for food/medicine/assistance/exercise   https://archive.fo/egPfr    *recoding because of policy coded in C6, which applies by default"
Luxembourg,LUX,20200408,20200419,H6: Facial Coverings,1,1,"On April 8th, the government published a document, titled “Covid-19: wearing a mask as an additional barrier gesture”, which stated:   “The virus that causes COVID-19 is capable of being transmitted even in the absence of symptoms. It is therefore recommended to cover the mouth and the nose, by a mask or even by another fabric, especially in public places where interpersonal distancing is difficult to maintain.” Source: http://web.archive.org/web/20200912162042/https://sante.public.lu/fr/actualites/2020/04/covid-19-port-du-masque-geste-barriere-additionnel/masque-brochure.pdf & http://web.archive.org/web/20200818062929/https://sante.public.lu/fr/actualites/2020/04/covid-19-port-du-masque-geste-barriere-additionnel/index.html"
Luxembourg,LUX,20200420,20201029,C6: Stay at home requirements,1,1,"While the Country begins it's exit strategy from shutdowns and lockdown, Residents are still advised to remain home when they are not at work (if essential workers), school or conducting business.   https://archive.fo/wip/MwplB"
Luxembourg,LUX,20200420,20200625,C7: Restrictions on internal movement,1,1,"The country is now entering the exit phase of lockdown and closures, limited movement is still advised while the country gradually reopens     https://archive.fo/wip/MwplB"
Luxembourg,LUX,20200420,20200720,H6: Facial Coverings,3,1,"Luxembourg enforced the use of masks. Prime Minister Xavier Bettel said: “people would be required to use a mask or other covering such as a scarf over their mouths if they were not able to keep 2 metres away from each other.” Source: http://web.archive.org/web/20200912161628if_/https://uk.reuters.com/article/us-health-coronavirus-luxembourg-idUKKBN2221W3"
Luxembourg,LUX,20200420,20200715,H8: Protection of elderly people,1,1,"Recommended protections in place for the cautious lifting of confinement measures. No specific measures in place for elderly persons.  source: https://archive.fo/MwplB"
Luxembourg,LUX,20200504,20200524,C1: School closing,2,1,"While doing the C1 review, I looked at the ministry of education’s archive of press announcements. There is an announcement that secondary education restarted on 4th May.    https://archive.vn/ocgHa    Per previous coding, Schools resumed their classes on Monday 11 May, one week after the first and final students. Pupils returning to school will be separated, circulation will be controlled, and masks are obligatory if two metre distance cannot be kept.    https://archive.vn/6z5nL    Subsequent coding comment indicates that primary schools were still closed until including 24th May, so 2G is valid for this period (at least one level fully closed). Unfortunately, the source had not been archived and now 404s.   Source from previous coding: https://covid19.public.lu/fr/communications-officielles.gouvernement+fr+actualites+toutes_actualites+articles+2020+05-mai+15-meisch-reprise-enseignement.html    Found a different source on the ministry’s website that explains the tiered school re-opening:  •	From 4th May: final classes in secondary education  •	From 11th May: all other classes in secondary education, but not elementary schools  •	From 25th May: Elementary schools    https://archive.vn/i7rrk  "
Luxembourg,LUX,20200511,20201125,C2: Workplace closing,1,1,"Full reopening of businesses but recommend work from home if possible"
Luxembourg,LUX,20200511,20200625,C4: Restrictions on gatherings,3,1,"20 people"
